Title1,Title_URL,authors,paper_link,type,Scholarlink,time_since_pull,query_text_match
"Post COVID-19 symptoms are common, also among young adults in the general population",https://www.nature.com/articles/s41598-023-38315-2,"I Mogensen, S Ekström, J Hallberg, A Georgelis… - Scientific Reports, 2023 - nature.com",https://www.nature.com/articles/s41598-023-38315-2,[HTML] nature.com,,5 days ago,"definition of post COVID-19 in December 2021: “Post COVID-19 condition is  
coronavirus 2 (SARS-CoV-2) infection; usually within three months from the onset of COVID-19…"
"Kinetics of specific anti-SARS-CoV-2 IgM, IgA, and IgG responses during the first 12 months after SARS-CoV-2 infection: A prospective longitudinal study",https://journals.plos.org/plosone/article?id=10.1371/journal.pone.0288557,"H Amellal, N Assaid, H Charoute, K Akarid, A Maaroufi… - Plos one, 2023 - journals.plos.org",https://journals.plos.org/plosone/article?id=10.1371/journal.pone.0288557,[HTML] plos.org,https://scholar.google.com/citations?user=i9DJ1nAAAAAJ&hl=en&oi=sra,5 days ago,"of severe acute respiratory syndrome coronavirus 2 (SARS-CoV-2) began 
with its  COVID-19 is the disease caused by SARS-CoV-2 and can manifest itself with a wide"
The yield of procalcitonin and Interleukin-6 in predicting intraamniotic infection in the presence of intrapartum fever: A pilot study,https://journals.plos.org/plosone/article?id=10.1371/journal.pone.0288537,"Z Ehrlich, S Magen, H Alexandroni, I Glik… - Plos one, 2023 - journals.plos.org",https://journals.plos.org/plosone/article?id=10.1371/journal.pone.0288537,[HTML] plos.org,,5 days ago,"COVID-19 pandemic and recruitment occurred during the pandemic. However, 
all participants tested negative for COVID-19,  by Coronavirus disease 2019 (COVID-19): a"
Estimating the instantaneous reproduction number (R_t) by using particle filter,https://www.medrxiv.org/content/10.1101/2023.07.09.23292422.abstract,"YS Won, WS Son, S Choi, JH Kim - medRxiv, 2023 - medrxiv.org",https://www.medrxiv.org/content/medrxiv/early/2023/07/12/2023.07.09.23292422.full.pdf,[PDF] medrxiv.org,https://scholar.google.com/citations?user=4rFE7egAAAAJ&hl=en&oi=sra,5 days ago,"Monitoring the transmission of coronavirus disease 2019 (COVID-19) requires 
… but still to capture the reality of SARS-CoV 2 transmission that would hover around the"
Vaccinations in children with hematologic malignancies and those receiving hematopoietic stem cell transplants or cellular therapies,https://onlinelibrary.wiley.com/doi/full/10.1111/tid.14100,"KA Neemann, AI Sato - Transplant Infectious Disease, 2023 - Wiley Online Library",https://onlinelibrary.wiley.com/doi/full/10.1111/tid.14100,[HTML] wiley.com,,5 days ago,"coronavirus 2 (SARS-CoV-2) also decreases the risk of  risk of SARS-CoV2 
breakthrough infection and COVID-19  should follow the COVID-19 vaccination according to"
"Computational Aspects: Self-clean Coatings, Plastics and Polymers in Coatings",https://link.springer.com/chapter/10.1007/978-981-99-3549-9_8,"HS Gupta, U Shankar, A Verma, R Gogoi… - … Aspects, Applications and …, 2023 - Springer",,,https://scholar.google.com/citations?user=7KtxgPoAAAAJ&hl=en&oi=sra,5 days ago,"In the recent pandemic of COVID-19, the MD simulations have acted as a very 
… COVID-19 transmission. In the same line, Kushwaha et al. [54] have explored the COVID-19"
… in income-support payments reduce the demand for charity: A difference-in-difference analysis of charitable-assistance data from Australia over the COVID-19 …,https://journals.plos.org/plosone/article?id=10.1371/journal.pone.0287533,"C Ablaza, F Perales, C Parsell, N Middlebrook… - Plos one, 2023 - journals.plos.org",https://journals.plos.org/plosone/article?id=10.1371/journal.pone.0287533,[HTML] plos.org,https://scholar.google.com/citations?user=LkMM_fsAAAAJ&hl=en&oi=sra,5 days ago,"% of the population aged 15 and above—received the Coronavirus 
Supplement,  poverty from worsening due to the impacts of COVID-19, but in fact reduced pre-…"
"… and meta‐analysis on the serological, immunological, and cardiac parameters of the multisystem inflammatory syndrome (MIS‐C) associated with SARS‐CoV‐2 …",https://onlinelibrary.wiley.com/doi/abs/10.1002/jmv.28927,"G Ghazizadeh Esslami, S Mamishi… - Journal of Medical …, 2023 - Wiley Online Library",,,,5 days ago,"Coronavirus disease 2019 (COVID-19), induced by the novel severe acute 
respiratory syndrome coronavirus 2 (SARS-CoV-2),  During the global spread of the COVID-19"
Malformación anorrectal con fístula rectovesical: a propósito de un caso,https://revholcien.sld.cu/index.php/holcien/article/view/266,"TC Expósito, EC Peña, BYP García - Revista Estudiantil HolCien, 2023 - revholcien.sld.cu",https://revholcien.sld.cu/index.php/holcien/article/download/266/152,[PDF] sld.cu,,5 days ago,"days ago - El ano imperforado es uno de los defectos estructurales del tubo digestivo más 
frecuentes. En octubre de 1980 se practica por primera vez la técnica de anorrectoplastia"
Impacto de la pandemia por COVID-19 en los programas de cribado poblacional de cáncer en Navarra,https://pesquisa.bvsalud.org/portal/resource/pt/ibc-222500,"M Ederra Sanz, M Rodrigo Olave… - An. sist. sanit …, 2023 - pesquisa.bvsalud.org",,,,5 days ago,"COVID-19 en Navarra ha impactado tanto en la atención de los pacientes 
infectados por SARS-CoV-2  físicos a la atención de la COVID-19. Durante 2020 la cobertura por"
Exploring the multifaceted potential of chlorogenic acid: Journey from nutraceutical to nanomedicine,https://www.sciencedirect.com/science/article/pii/S0254629923003587,"SK Singh, K Thakur, V Sharma, M Saini… - South African Journal of …, 2023 - Elsevier",,,https://scholar.google.com/citations?user=e-Ml-EsAAAAJ&hl=en&oi=sra,5 days ago,"It has been reported that CS act against COVID-19 via innate immune stimulation 
… the severe acute respiratory illness coronavirus 2 (SARS-CoV-2) (Zannella et al., 2021)."
Effect of DMARDs on the immunogenicity of vaccines,https://www.nature.com/articles/s41584-023-00992-8,"Y van Sleen, KSM van der Geest… - Nature Reviews …, 2023 - nature.com",,,,5 days ago,"This Review focuses on the impact of DMARDs on influenza and SARS-CoV-2  
infected cells, only some vaccine platforms are potent activators of these cells 18,19 ."
Analysis of SARS-CoV-2 spike RBD binding to ACE2 and its inhibition by fungal cohaerin C using surface enhanced Raman spectroscopy,https://opg.optica.org/abstract.cfm?uri=boe-14-8-4097,"C Wetzel, L Jansen-Olliges, M Stadler… - Biomedical Optics …, 2023 - opg.optica.org",https://opg.optica.org/boe/fulltext.cfm?uri=boe-14-8-4097,[HTML] optica.org,https://scholar.google.com/citations?user=iFieKogAAAAJ&hl=en&oi=sra,5 days ago,"as investigating SARS-CoV-2. To measure also small amounts of SARS-CoV-2 
and  of the protein structure of the SARS-CoV-2 spike RBD and the ACE2 receptor as well"
Adjuvant Oligonucleotide Vaccine Increases Survival and Improves Lung Tissue Condition of B6. Cg-Tg (K18-ACE2) 2 Transgenic Mice,https://www.mdpi.com/2218-0532/91/3/35,"VV Oberemok, KV Laikova, KA Yurchenko… - Scientia …, 2023 - mdpi.com",https://www.mdpi.com/2218-0532/91/3/35/pdf,[PDF] mdpi.com,https://scholar.google.com/citations?user=1usyDvsAAAAJ&hl=en&oi=sra,5 days ago,"our next encounter with a SARS-CoV-2 coronavirus pandemic. Unfortunately, 
there  in prophylaxes of COVID-19 and other diseases caused by coronaviruses and RNA"
The Effects of Zingiber Officinale and Propolis supplementation on Hospitalized Covid-19 Patients' Oxygen Saturation,https://journal.ugm.ac.id/v3/IJP/article/view/3544,"RD Yudhani, YH Suselo, D Rahayu… - Indonesian Journal of … - journal.ugm.ac.id",,,https://scholar.google.com/citations?user=xhjR3hcAAAAJ&hl=en&oi=sra,5 days ago,"in the Covid-19 management, whilst there is no available specific antiviral for 
Covid-19  However, their efficacy in hospitalized Covid-19 patients has not been clarified yet."
… collaborative consensus guidance statement on the assessment and treatment of neurologic sequelae in patients with post-acute sequelae of SARS-CoV-2 …,https://congress-med.ru/assets/files/2023/2023-rukovodstvo-po-lecheniyu-nevrologicheskix-oslozhnenij-postkovidnogo-sindroma.pdf,"L Rydberg, AF Ambrose, R Bhavaraju-Sanka, JS Fine… - congress-med.ru",https://congress-med.ru/assets/files/2023/2023-rukovodstvo-po-lecheniyu-nevrologicheskix-oslozhnenij-postkovidnogo-sindroma.pdf,[PDF] congress-med.ru,https://scholar.google.com/citations?user=pCk2x7AAAAAJ&hl=en&oi=sra,5 days ago,"COVID-19 has been a transformative novel disease in modern health care. 
Unlike many other viral illnesses, COVID-19  of SARS-CoV-2 infection (PASC) or longCOVID"
A Real-World Multicenter Retrospective Observational Study on Polish Experience with Nintedanib Therapy in Patients with Idiopathic Pulmonary Fibrosis …,https://www.mdpi.com/2077-0383/12/14/4635,"S Majewski, AJ Białas, A Barczyk… - Journal of Clinical …, 2023 - mdpi.com",https://www.mdpi.com/2077-0383/12/14/4635,[HTML] mdpi.com,https://scholar.google.com/citations?user=cmZsyKQAAAAJ&hl=en&oi=sra,5 days ago,"were related to coronavirus disease 2019 (COVID-19). This  coronavirus 2 
(SARS-CoV-2), which causes COVID-19, and  and severity of SARS-CoV-2 infections among all"
First Stabilize and then Gradually Recruit: A Paradigm Shift in Protective Mechanical Ventilation for Acute Lung Injury,https://www.mdpi.com/2077-0383/12/14/4633,"GF Nieman, DW Kaczka, PL Andrews, A Ghosh… - Journal of Clinical …, 2023 - mdpi.com",https://www.mdpi.com/2077-0383/12/14/4633,[HTML] mdpi.com,https://scholar.google.com/citations?user=7cP9pnkAAAAJ&hl=en&oi=sra,5 days ago,"days ago - Acute respiratory distress syndrome (ARDS) is associated with a heterogeneous 
pattern of injury throughout the lung parenchyma that alters regional alveolar opening"
Long COVID prevalence and associated characteristics among a South Alabama population,https://www.sciencedirect.com/science/article/pii/S003335062300197X,"CL Daniel, S Fillingim, J James, J Bassler, A Lee - Public Health, 2023 - Elsevier",,,https://scholar.google.com/citations?user=qEcMzisAAAAJ&hl=en&oi=sra,5 days ago,"more than 1.5 million COVID-19 cases and more than  symptoms due to the 
current coronavirus is not novel, as  of SARS-CoV-2 (PASC) after diagnosis of symptomatic"
Microbes & US (E-Magazine),https://www.iarj.in/index.php/ijrase/article/view/221,"S Mukherjee - International Journal of Research and Analysis in …, 2023 - iarj.in",https://www.iarj.in/index.php/ijrase/article/download/221/266,[PDF] iarj.in,,5 days ago,"of SARS-CoV-2"". The goal is to genetically express the spike glycoprotein of 
severe acute respiratory syndrome coronavirus 2 (… The Covid 19 pandemic had changed our"
Global landscape of encephalitis: key priorities to reduce future disease burden,https://academic.oup.com/cid/advance-article-abstract/doi/10.1093/cid/ciad417/7223266,"J Granerod, Y Huang, NWS Davies… - Clinical Infectious …, 2023 - academic.oup.com",https://academic.oup.com/cid/advance-article-pdf/doi/10.1093/cid/ciad417/50861175/ciad417.pdf,[PDF] oup.com,https://scholar.google.com/citations?user=8NTevfUAAAAJ&hl=en&oi=sra,5 days ago,"The effects of Zika virus, severe acute respiratory syndrome coronavirus 2, 
and  BDM is supported to conduct COVID-19 neuroscience research by the UKRI/MRC (MR/…"
"Experiencias frente a la vacunación contra la COVID-19 de los adultos mayores en un centro de salud de Chota, 2022",http://tesis.usat.edu.pe/handle/20.500.12423/6149,ME Benavidez Diaz - 2023 - tesis.usat.edu.pe,http://tesis.usat.edu.pe/bitstream/20.500.12423/6149/1/%C2%B4TL_BenavidesDiazMerly.pdf,[PDF] usat.edu.pe,,5 days ago,", ocasionada por el coronavirus (COVID-19), cuya principal manifestación 
es el síndrome respiratorio agudo severo coronavirus (SARSCoV-2), es responsable de 9,2"
Impact of coronavirus disease 2019 (COVID-19) on antimicrobial resistance among major pathogens causing healthcare-associated infection,https://www.sciencedirect.com/science/article/pii/S0929664623002541,"HC Chang, CH Chang, KL Tien, CH Tai, LM Lin… - Journal of the Formosan …, 2023 - Elsevier",https://www.sciencedirect.com/science/article/pii/S0929664623002541,[HTML] sciencedirect.com,,5 days ago,"hand, precautions for preventing SARS-CoV-2 spreading have been applied 
by  and during COVID-19 pandemic, in order to know the effect of COVID-19 on epidemiology"
Judicial review: a atuação do Poder Judiciário diante da Lei 14.151/2021 que afastou as gestantes do trabalho presencial durante a pandemia,https://seer.ufu.br/index.php/revistafadir/article/download/65622/36338/316711,"MAS Junior, IC Iantas - seer.ufu.br",https://seer.ufu.br/index.php/revistafadir/article/download/65622/36338/316711,[PDF] ufu.br,,5 days ago,"Resumo: A pandemia de COVID-19 trouxe a necessidade de reconfiguração 
do  de importância nacional decorrente do coronavírus SARS-CoV-2, a empregada gestante"
Vulnerabilidades dos povos indígenas na fronteira Brasil-Paraguai eo contexto da pandemia de Covid-19,https://seer.ufu.br/index.php/revistafadir/article/download/63585/36339/316712,"EGM Filho, AHA Urquiza - seer.ufu.br",https://seer.ufu.br/index.php/revistafadir/article/download/63585/36339/316712,[PDF] ufu.br,https://scholar.google.com/citations?user=6RutgmAAAAAJ&hl=en&oi=sra,5 days ago,"Abstract: This article aims to analyze the vulnerabilities of indigenous peoples 
to the new coronavirus pandemic in the border region between Brazil and Paraguay. This is"
AA PANDEMIA DE COVID-19 E SEU IMPACTO NA REDE DE SAÚDE PRIVADA BRASILEIRA,https://ojs.focopublicacoes.com.br/foco/article/view/2371,"JE Ribeiro, EA Silva… - REVISTA …, 2023 - ojs.focopublicacoes.com.br",https://ojs.focopublicacoes.com.br/foco/article/download/2371/1618,[PDF] focopublicacoes.com.br,,5 days ago,"Ainda segundo estes autores, “o surto de Covid-19, causado pelo vírus 
zoonótico SARS-CoV-2 é, no presente, a maior apreensão global, e uma das jamais vistas na"
Systems-level profiling of early peripheral host-response landscape variations across COVID-19 severity states in an Indian cohort,https://www.nature.com/articles/s41435-023-00210-1,"U Banerjee, S Chunchanur, KN Balaji, A Singh… - Genes & …, 2023 - nature.com",,,https://scholar.google.com/citations?user=xc1Q16sAAAAJ&hl=en&oi=sra,5 days ago,"COVID-19 in China, different aspects of the disease have been widely studied. 
Host immune response to SARS-CoV-2  families of viruses including coronaviruses. Our"
Relación entre el uso de videojuegos durante la pandemia de covid-19 y la conducta agresiva en adolescentes que regresan a clases presenciales después del …,https://revista.infad.eu/index.php/IJODAEP/article/view/2492,"CVM González, KIQ Ochoa, SLP Ruvalcaba… - Revista INFAD de …, 2023 - revista.infad.eu",https://revista.infad.eu/index.php/IJODAEP/article/download/2492/2130,[PDF] infad.eu,https://scholar.google.com/citations?user=ujqmT-gAAAAJ&hl=en&oi=sra,5 days ago,"El SARS COV-2 familia de los coronavirus apareció en China en diciembre 
2019 y provocó una enfermedad llamada COVID-19 que se extendió por el mundo,"
Covid persistente: la influencia de la funcionalidad sobre la calidad de vida y la accesibilidad,https://revista.infad.eu/index.php/IJODAEP/article/view/2490,"RV Santamaría, JF Solana… - Revista INFAD de …, 2023 - revista.infad.eu",https://revista.infad.eu/index.php/IJODAEP/article/download/2490/2128,[PDF] infad.eu,,5 days ago,"El COVID-19 persistente es una enfermedad que lleva  con COVID-19 y las 
que han desarrollado COVID persistente. Se  /s antes de la infección aguda por SARS- COV-2."
… Nilai Clinical Skill Lab Blok Muskuloskeletal Mahasiswa Fakultas Kedokteran Universitas Hasanuddin Sebelum dan Selama Pandemi COVID-19 pada Angkatan 2018 …,http://repository.unhas.ac.id/id/eprint/27165/,ASA Machira - 2023 - repository.unhas.ac.id,http://repository.unhas.ac.id/id/eprint/27165/3/C011191163_skripsi_10-05-2023%20bab%201-3.pdf,[PDF] unhas.ac.id,,5 days ago,"merupakan bagian dari genus beta coronavirus yang memiliki hubungan dekat 
… yang dimiliki COVID-19 dan SARS mencapai 76%. Virus SARS-CoV-2 merupakan virus"
Karakteristik Pasien Covid-19 Pada Anak di RSUP Dr. Wahidin Sudirohusodo Makassar Periode 2020,http://repository.unhas.ac.id/id/eprint/27163/,R Rabbaniyah - 2023 - repository.unhas.ac.id,http://repository.unhas.ac.id/id/eprint/27163/2/C011191076_skripsi_12-05-2023%20bab%201-3.pdf,[PDF] unhas.ac.id,,5 days ago,": Covid-19 merupakan penyakit infeksi respirasi menular yang disebabkan 
oleh SARS-CoV-2.  adalah Severe acute respiratory syndrome coronavirus 2 (SARS-CoV-2)."
Conocimiento y actitud hacia la aplicación de medidas preventivas frente al COVID-19 en el nivel secundario de la IE Don José de San Martín del Distrito Alto de la …,http://redi.unjbg.edu.pe/handle/UNJBG/4994,JA Amaya Quísper - 2023 - redi.unjbg.edu.pe,http://redi.unjbg.edu.pe/bitstream/handle/UNJBG/4994/2358_2023_amaya_quisper_jdla_facs_enfermeria.pdf?sequence=1&isAllowed=y,[PDF] unjbg.edu.pe,,5 days ago,"Virus que causa una enfermedad respiratoria llamada enfermedad por 
coronavirus de 2019 (COVID-19). El SARS-CoV-2 es un virus de la gran familia de los coronavirus."
Analysis of Large SARS-CoV-2 Data using Scalable Genetic Algorithm with Enhanced Bi-LSTM Method,https://ijisae.org/index.php/IJISAE/article/view/3096,"U Singh, A Raundale - International Journal of Intelligent Systems and …, 2023 - ijisae.org",https://ijisae.org/index.php/IJISAE/article/download/3096/1677,[PDF] ijisae.org,https://scholar.google.com/citations?user=RCxNLyIAAAAJ&hl=en&oi=sra,5 days ago,"there was an outbreak of persistent coronavirus disease (COVID19) caused by 
a new  model that can be used to analyze and predict the large-scale SARS-CoV-2 disease."
Outcomes of hematologic malignancy patients with SARS-CoV-2 breakthrough infections after tixagevimab-cilgavimab during community transmission of monoclonal …,https://www.journalofinfection.com/article/S0163-4453(23)00378-X/abstract,"M Kamboj, JC Laracy, S Usiak, NE Babady… - Journal of …, 2023 - journalofinfection.com",,,,5 days ago,", for primary Coronavirus Disease 2019 (COVID-19) prevention  suggests 
substantial COVID-19 morbidity among  Our findings indicate that COVID-19 rebound symptoms"
PLSCR1 is a cell-autonomous defence factor against SARS-CoV-2 infection,https://www.nature.com/articles/s41586-023-06322-y,"D Xu, W Jiang, L Wu, RG Gaudet, ES Park, M Su… - Nature, 2023 - nature.com",https://www.nature.com/articles/s41586-023-06322-y,[HTML] nature.com,https://scholar.google.com/citations?user=-QTeljoAAAAJ&hl=en&oi=sra,5 days ago,"-SARS-CoV-2 defence. Characterizing its activity will provide insights into how 
cell-autonomous immunity confers frontline resistance during COVID-19  blocks coronavirus"
"Aplicación y cumplimiento del Acuerdo Ministerial MDT-2020-181, en cuanto al horario de teletrabajo en el área administrativa de la empresa privada del sector …",http://www.dspace.uce.edu.ec/handle/25000/30711,"C Astudillo, M Stephanie - 2023 - dspace.uce.edu.ec",http://www.dspace.uce.edu.ec:8080/bitstream/25000/30711/1/UCE-FJCPS-CD-COFFRE%20MISHEL.pdf,[PDF] uce.edu.ec,,5 days ago,"emergencia sanitaria derivada por la pandemia del Coronavirus (COVID-19), 
infección provocada por el virus del SARS-COv2. Con la necesidad imperante de proteger"
Prolonged-release pirfenidone in patients with pulmonary fibrosis as a phenotype of post-acute sequelae of COVID-19 pneumonia. Safety and efficacy,https://www.sciencedirect.com/science/article/pii/S0954611123002500,"RH Sansores, A Ramírez-Venegas, F Montiel-Lopez… - Respiratory …, 2023 - Elsevier",,,https://scholar.google.com/citations?user=IFNOmz0AAAAJ&hl=en&oi=sra,5 days ago,"Coronavirus disease 2019 (COVID-19), caused by severe acute respiratory 
syndrome coronavirus-2 (SARS-CoV-2… acute sequelae of COVID-19 (PASC) or Long COVID [4,…"
When the answer is a maybe: a retrospective review of indeterminate SARS-CoV-2 results and their associations,https://www.sciencedirect.com/science/article/pii/S0195670123002153,"AM Dolan, S FitzGerald - Journal of Hospital Infection, 2023 - Elsevier",,,,5 days ago,"Respiratory Syndrome Coronavirus 2 (SARS-CoV-2)  observational study of 
indeterminate SARS-CoV-2 results in an  In the Detected group, a prior diagnosis of COVID-19"
ENSINO REMOTO NA PANDEMIA DA COVID-19 E RISCOS NA SAÚDE DAS DOCENTES DO ENSINO PRIVADO NA BAHIA,https://preprints.scielo.org/index.php/scielo/preprint/view/6389,"LO Sales, J Ferreira, PGL Pena, P de Sousa Pinho… - 2023 - preprints.scielo.org",https://preprints.scielo.org/index.php/scielo/preprint/download/6389/12188,[PDF] scielo.org,https://scholar.google.com/citations?user=FDgJb3IAAAAJ&hl=en&oi=sra,5 days ago,"do trabalho presencial na pandemia da Covid-19, com sua imediata substituição 
… A pandemia da Covid-19, doença respiratória infecciosa provocada pelo vírus SarsCoV-2…"
Indol-3-ylglyoxylamide as Privileged Scaffold in Medicinal Chemistry,https://www.mdpi.com/1424-8247/16/7/997,"E Barresi, M Robello, E Baglini, V Poggetti, M Viviano… - Pharmaceuticals, 2023 - mdpi.com",https://www.mdpi.com/1424-8247/16/7/997,[HTML] mdpi.com,https://scholar.google.com/citations?user=YDzoLG4AAAAJ&hl=en&oi=sra,5 days ago,"after therapy discontinuation was observed [18,19]. Unfortunately, when 
administered at  to treat stage I, stage II, or stage III COVID-19 or COVID-19 cytokine storm [157]."
PERSEPSI GENERASI Z TERHADAP KOMUNIKASI PUBLIK DI MASA PANDEMI COVID-19,https://ejournal3.undip.ac.id/index.php/empati/article/view/38739,"AT La Biba, DS Zefanya, D Rifaldy… - Jurnal …, 2023 - ejournal3.undip.ac.id",https://ejournal3.undip.ac.id/index.php/empati/article/download/38739/29466,[PDF] undip.ac.id,,5 days ago,"The COVID-19 pandemic changes people's behavior  in information related 
to COVID-19 with the consideration of  They perceive the COVID-19's task force and IDI as"
Clinician's Guide to Using Ozanimod for the Treatment of Ulcerative Colitis,https://academic.oup.com/ecco-jcc/advance-article-abstract/doi/10.1093/ecco-jcc/jjad112/7223210,"BE Sands, S Schreiber, I Blumenstein… - Journal of Crohn's …, 2023 - academic.oup.com",https://academic.oup.com/ecco-jcc/advance-article-pdf/doi/10.1093/ecco-jcc/jjad112/50860669/jjad112.pdf,[PDF] oup.com,https://scholar.google.com/citations?user=jmhf3N0AAAAJ&hl=en&oi=sra,5 days ago,"acute respiratory syndrome coronavirus 2 (SARS-CoV-2)  MS who contracted 
COVID-19 had nonserious infections (… patients with serious COVID-19 fully recovered without"
Powrót po pandemii–stan zdrowia psychicznego studentów Politechniki Białostockiej,"http://info.wiz.pb.edu.pl/media/a149318e-1f73-459f-a3bd-1bfa9b115306/svb5tw/Nauka%20i%20badania/Czasopismo%20Akademia%20Zarzadzania/2023%20Volume%207%20Issue%202/9.2.%20M.%20Staworko,%20M.%20W%C3%84%E2%80%A6sowska,%20K.%20Wo%C3%85%E2%80%9Aosiewicz,%20I.%20Stalo%C3%85%E2%80%9Eczyk,%20Powr%C3%83%C2%B3t%20po%20pandemii%20%C3%A2%E2%82%AC%E2%80%9C%20stan%20zdrowia%20psychicznego%20student%C3%83%C2%B3w....pdf","M Staworko, M Wąsowska, K Wołosiewicz, I Stalończyk - info.wiz.pb.edu.pl","http://info.wiz.pb.edu.pl/media/a149318e-1f73-459f-a3bd-1bfa9b115306/svb5tw/Nauka%20i%20badania/Czasopismo%20Akademia%20Zarzadzania/2023%20Volume%207%20Issue%202/9.2.%20M.%20Staworko,%20M.%20W%C3%84%E2%80%A6sowska,%20K.%20Wo%C3%85%E2%80%9Aosiewicz,%20I.%20Stalo%C3%85%E2%80%9Eczyk,%20Powr%C3%83%C2%B3t%20po%20pandemii%20%C3%A2%E2%82%AC%E2%80%9C%20stan%20zdrowia%20psychicznego%20student%C3%83%C2%B3w....pdf",[PDF] pb.edu.pl,https://scholar.google.com/citations?user=hmKtE7MAAAAJ&hl=en&oi=sra,5 days ago,"Celem artykułu jest zbadanie wpływu COVID-19 na zdrowie psychiczne 
studentów  The coronavirus pandemic had a significant impact on the lives of representatives of"
Increased Emergency Department Stays for Mental Health of Insured Youth in Year 2 of the COVID-19 Pandemic—Moving Forward,https://jamanetwork.com/journals/jamapsychiatry/article-abstract/2806890,"KB Wells - JAMA psychiatry, 2023 - jamanetwork.com",,,,5 days ago,"to avoid exposure to the SARSCoV-2 virus and staffing issues)  Articles on 
the effect of the COVID-19 pandemic on  program for the COVID-19 pandemic with input from"
Risk Factors and Outcomes Associated With Reintubation Secondary to Respiratory Failure in COVID-19 Subjects With ARDS,https://rc.rcjournal.com/content/early/2023/07/12/respcare.10881.abstract,"RM Halaseh, GS Drescher, IH Masri, AL Alayon… - Respiratory …, 2023 - rc.rcjournal.com",,,https://scholar.google.com/citations?user=zT3UgLYAAAAJ&hl=en&oi=sra,5 days ago,"Infection with Sars-CoV-2 is associated with variable symptoms and clinical 
sequelae… Prevalence and risk factors for delirium in critically ill patients with COVID-19 (COVID-…"
"IMPLICAÇÕES DO COVID-19 NO CORAÇÃO: PRESENÇA DE MIOCARDITE, E/OU SINTOMAS SUGESTIVOS",https://periodicorease.pro.br/rease/article/view/10421,"MHS Pêgas, IPB de Aragão - Revista Ibero-Americana de …, 2023 - periodicorease.pro.br",https://periodicorease.pro.br/rease/article/download/10421/4254,[PDF] periodicorease.pro.br,,5 days ago,"de 2019 (Coronavirus Disease - COVID-19) causada  Acute Respiratory 
Syndrome Coronavirus 2 - SARS-CoV-2)  de miocardite viral como complicação do SARS-CoV-2)."
