Title1,Title_URL,authors,paper_link,type,Scholarlink,time_since_pull,query_text_match,Keyword
Using real-time ascertainment rate estimate from infection and hospitalization dataset for modeling the spread of infectious disease: COVID-19 case study in …,https://journals.plos.org/plosone/article?id=10.1371/journal.pone.0287959,"L Přibylová, V Eclerová, O Májek, J Jarkovský, T Pavlík… - Plos one, 2023 - journals.plos.org",https://journals.plos.org/plosone/article?id=10.1371/journal.pone.0287959,[HTML] plos.org,https://scholar.google.com/citations?user=7n10Ej0AAAAJ&hl=en&oi=sra,4 days ago,"In the Czech Republic, data on reported SARS-CoV-2-positive individuals 
and COVID-19 patients and their hospital stays are collected and processed by the Information",tech
Upper and/or lower respiratory tract infection caused by human metapneumovirus after allogeneic hematopoietic stem cell transplantation,https://academic.oup.com/jid/advance-article-abstract/doi/10.1093/infdis/jiad268/7223877,"JL Piñana, G Tridello, A Xhaard… - The Journal of …, 2023 - academic.oup.com",,,,4 days ago,", as occurred during the COVID-19 pandemic, a dramatic  to those recently 
reported with SARS-CoV-2 in the allo-HCT  Seasonality of coronaviruses and other respiratory",molecules
Association analysis between symptomology and herpesvirus IgG antibody concentrations in myalgic encephalomyelitis/chronic fatigue syndrome (ME/CFS) …,https://www.cell.com/heliyon/pdf/S2405-8440(23)05458-0.pdf,"TD Domingues, J Malato, AD Grabowska, JS Lee… - Heliyon, 2023 - cell.com",https://www.cell.com/heliyon/pdf/S2405-8440(23)05458-0.pdf,[PDF] cell.com,https://scholar.google.com/citations?user=C2mzp40AAAAJ&hl=en&oi=sra,4 days ago,"Notwithstanding the recent observation of VZV reactivation after SARS-CoV-2 
infections  COVID Syndrome correlate with symptom 956 severity, Front. Immunol. 13 (2022).",tech
Selection for immune evasion in SARS-CoV-2 revealed by high-resolution epitope mapping and sequence analysis.,https://www.cell.com/iscience/pdf/S2589-0042(23)01471-2.pdf,"A N'Guessan, S Kailasam, F Mostefai, R Poujol… - iScience, 2023 - cell.com",https://www.cell.com/iscience/pdf/S2589-0042(23)01471-2.pdf,[PDF] cell.com,https://scholar.google.com/citations?user=jYjqZM0AAAAJ&hl=en&oi=sra,4 days ago,"of coronavirus infections, including SARS-CoV-2 19-24.  One prevailing view 
in our understanding of COVID-19  hCoVs is a hallmark feature of SARS-CoV-2- 254 infected",tech
COVID-19 pneumonia: Perfusion abnormalities shown on subtraction CT angiography in apparently well-ventilated lungs. A prospective cohort study,https://www.sciencedirect.com/science/article/pii/S2405844023052933,"MG Santamarina, FM Lomakin, I Beddings, DB Riscal… - Heliyon, 2023 - Elsevier",https://www.sciencedirect.com/science/article/pii/S2405844023052933,[HTML] sciencedirect.com,,4 days ago,"SARS-CoV-2 infections, sCTA was established as a standard imaging 
procedure for patients that were hospitalized with COVID-19  coronavirus disease 2019 (COVID-19)",genetic_tools
Priority COVID-19 measures in nursing homes,https://www.sciencedirect.com/science/article/pii/S2666142X23000267,"LS van Tol, HJA Smaling, SIM Janus… - International Journal of …, 2023 - Elsevier",https://www.sciencedirect.com/science/article/pii/S2666142X23000267,[HTML] sciencedirect.com,,4 days ago,"From September 2020 until June 2021, the indistinguishable second and 
third waves of coronavirus infections were ongoing (CBS). By the end of the study period in",Vaccine
Immune evasion and ACE2 binding affinity contribute to SARS-CoV-2 evolution,https://www.nature.com/articles/s41559-023-02123-8,"W Ma, H Fu, F Jian, Y Cao, M Li - Nature Ecology & Evolution, 2023 - nature.com",,,https://scholar.google.com/citations?user=Dh8Tu2QAAAAJ&hl=en&oi=sra,4 days ago,"-quality SARS-CoV-2 genomes 19 . We found that the proportion of mutations 
in the RBD region increased over time, which was mainly due to the excess number of non-…",immune
COVID-19 associated liver injury: An updated review on the mechanisms and management of risk groups,https://www.sciencedirect.com/science/article/pii/S2542568423000363,"Y Shi, M Wang, L Wu, X Li, Z Liao - Liver Research, 2023 - Elsevier",https://www.sciencedirect.com/science/article/pii/S2542568423000363,[HTML] sciencedirect.com,https://scholar.google.com/citations?user=ExSGxBcAAAAJ&hl=en&oi=sra,4 days ago,", coronavirus disease 2019 (COVID-19) caused by severe acute respiratory 
syndrome coronavirus 2 (SARS-CoV-2)  abnormalities can occur in patients with COVID-19.",other_conditions
A non-linear optimal control model for illicit drug use and terrorism dynamics in developing countries with time-dependent control variables,https://www.sciencedirect.com/science/article/pii/S2772662223001212,"JO Akanni - Decision Analytics Journal, 2023 - Elsevier",https://www.sciencedirect.com/science/article/pii/S2772662223001212,[HTML] sciencedirect.com,https://scholar.google.com/citations?user=xQJFYmIAAAAJ&hl=en&oi=sra,4 days ago,"who studied a co-dynamical model for SARS-CoV-2 and HBV. The suggested 
model  reduce the co-circulation of both SARS-CoV-2 and HBV. Similarly, Akanni and",tech
Gradient Transparency of Semi-IPN PVA/PVME Electrospun Nanofibrous Membrane for Estimating the Remaining Life of Face Mask,https://www.sciencedirect.com/science/article/pii/S0014305723004767,"R Tang, S Gao, J Hou - European Polymer Journal, 2023 - Elsevier",,,,4 days ago,"spread of novel coronavirus disease 2019 (COVID-19)  for prevention and 
control of COVID-19 and PM 2.5 , which  approach to deactivating SARS-CoV-2 by applying an",tech
iSMOD: an integrative browser for image-based single-cell multi-omics data,https://academic.oup.com/nar/advance-article-abstract/doi/10.1093/nar/gkad580/7223586,"W Zhang, J Suo, Y Yan, R Yang, Y Lu… - Nucleic Acids …, 2023 - academic.oup.com",https://academic.oup.com/nar/advance-article-pdf/doi/10.1093/nar/gkad580/50876827/gkad580.pdf,[PDF] oup.com,https://scholar.google.com/citations?user=e4lel8QAAAAJ&hl=en&oi=sra,4 days ago,"also been reported in coronavirus disease 2019 (COVID19) studies. Investigations 
into severe acute respiratory syndrome coronavirus 2 (SARS-CoV-2) suggest that the",molecules
Recent progress and prospects for anti-cytokine therapy in preclinical and clinical acute lung injury,https://www.sciencedirect.com/science/article/pii/S1359610123000333,"GP Fadanni, JB Calixto - Cytokine & Growth Factor Reviews, 2023 - Elsevier",,,https://scholar.google.com/citations?user=4EDiauAAAAAJ&hl=en&oi=sra,4 days ago,"Furthermore, large trials of anti-cytokine drugs in patients with COVID-19 have 
… associated to human adenovirus (HAdV), SARS-CoV-2, IAV/H1N1 or bacterial pneumonia,",other_conditions
An agent-based model to simulate SARS-CoV-2 contamination of surfaces and meat cuts in processing plants,https://www.sciencedirect.com/science/article/pii/S0168160523002374,"NDM Luong, L Guillier, M Federighi, Y Guillois… - International Journal of …, 2023 - Elsevier",,,https://scholar.google.com/citations?user=R6kR2RgAAAAJ&hl=en&oi=sra,4 days ago,"food-safety culture during the COVID-19 pandemic, this  on the transmission 
of SARS-CoV-2 using a simulation-… patients with coronavirus disease-2019 (COVID-19). Nat",tech
Decision support tool to define the optimal pool testing strategy for SARS-CoV-2,https://www.sciencedirect.com/science/article/pii/S0167923623001215,"B Barracosa, J Felício, A Carvalho, LM Moreira… - Decision Support …, 2023 - Elsevier",,,https://scholar.google.com/citations?user=am0FdvcAAAAJ&hl=en&oi=sra,4 days ago,"policies during early stages of COVID-19 pandemic [14]  readmissions applying 
it to COVID-19 case study [15].  The ongoing coronavirus disease (SARS-CoV-2) raised",testing
A placental model of SARS-CoV-2 infection reveals ACE2-dependent susceptibility and differentiation impairment in syncytiotrophoblasts,https://www.nature.com/articles/s41556-023-01182-0,"J Chen, JA Neil, JP Tan, R Rudraraju, M Mohenska… - Nature Cell …, 2023 - nature.com",https://www.nature.com/articles/s41556-023-01182-0,[HTML] nature.com,,4 days ago,"SARS-CoV-2 infection causes COVID-19. Several clinical reports have 
linked COVID-19  However, the pathophysiological mechanisms underpinning SARS-CoV-2",tech
Mixed model-based deconvolution of cell-state abundances (MeDuSA) along a one-dimensional trajectory,https://www.nature.com/articles/s43588-023-00487-2,"L Song, X Sun, T Qi, J Yang - Nature Computational Science, 2023 - nature.com",https://www.nature.com/articles/s43588-023-00487-2,[HTML] nature.com,,4 days ago,"-seq data from patients with coronavirus disease 2019 (COVID-19), with the 
aim to  respiratory syndrome coronavirus 2 (SARS-CoV-2) infection. A COVID-19 peripheral",tech
LY6E is a pan-coronavirus restriction factor in the respiratory tract,https://www.nature.com/articles/s41564-023-01431-w,"KB Mar, AI Wells, MC Caballero Van Dyke… - Nature …, 2023 - nature.com",,,https://scholar.google.com/citations?user=8dstOXoAAAAJ&hl=en&oi=sra,4 days ago,"to SARS-CoV-2, with pathogenic outcomes that mirror mild to  coronavirus 
disease 2019 (COVID-19) in humans. From transcriptomic analysis of lungs of SARS-CoV-2-…",Lung_Cardio
COVID-19 Severity and Waning Immunity After up to 4 mRNA Vaccine Doses in 73 608 Patients With Cancer and 621 475 Matched Controls in Singapore: A …,https://jamanetwork.com/journals/jamaoncology/article-abstract/2807035,"WC Tan, JYJ Tan, JSJ Lim, RYC Tan, ARYB Lee… - JAMA …, 2023 - jamanetwork.com",https://jamanetwork.com/journals/jamaoncology/fullarticle/2807035,[HTML] jamanetwork.com,https://scholar.google.com/citations?user=iUBkLjMAAAAJ&hl=en&oi=sra,4 days ago,"patients with cancer over 2 separate time periods; September 15, 2021, to 
December 20, 2021, corresponding to the wave of infections predominated by the SARS-CoV-2",other_conditions
Superior boosting of neutralizing titers against Omicron SARS-CoV-2 variants by heterologous SCB-2019 vaccine vs a homologous booster in CoronaVac …,https://academic.oup.com/jid/advance-article-abstract/doi/10.1093/infdis/jiad262/7223730,"CC Roa Jr, MRA de Los Reyes… - The Journal of …, 2023 - academic.oup.com",https://academic.oup.com/jid/advance-article-abstract/doi/10.1093/infdis/jiad262/7223730,[HTML] oup.com,,4 days ago,"SARS-CoV-2 exposure, or medical history of COVID-19  COVID-19 
vaccines: their effectiveness against the severe acute respiratory syndrome coronavirus 2 (SARS-CoV-2…",tech
Implementing and Maintaining a SARS-CoV-2 Exposure Notification Application for Mobile Phones: The Finnish Experience,https://publichealth.jmir.org/2023/1/e46563,"M Pihlajamäki, S Wickström, K Puranen… - JMIR Public Health …, 2023 - publichealth.jmir.org",https://publichealth.jmir.org/2023/1/e46563,[HTML] jmir.org,,4 days ago,"and introduced restrictions due to the coronavirus outbreak [2]. In early  
SARS-CoV-2 transmission chains, as part of the government’s strategy to combat the COVID-19",tech
"Differences in medical education before, during, and in the post-peak period of the COVID-19 pandemic—exploring senior medical students' attitudes",https://bmcmededuc.biomedcentral.com/articles/10.1186/s12909-023-04489-6,"BF Vaca-Cartagena… - BMC Medical …, 2023 - bmcmededuc.biomedcentral.com",https://bmcmededuc.biomedcentral.com/articles/10.1186/s12909-023-04489-6,[HTML] biomedcentral.com,https://scholar.google.com/citations?user=clujv2kAAAAJ&hl=en&oi=sra,4 days ago,"coronavirus and its associated disease named coronavirus disease 2019 (COVID-19… 
severe acute respiratory syndrome 2 (SARS-CoV-2) strain, its associated variants,",long_covid
Research article antibody induction and immune response in nasal cavity by third dose of SARS-CoV-2 mRNA vaccination,https://virologyj.biomedcentral.com/articles/10.1186/s12985-023-02113-z,"A Ishizaka, M Koga, T Mizutani, R Uraki… - Virology …, 2023 - virologyj.biomedcentral.com",https://virologyj.biomedcentral.com/articles/10.1186/s12985-023-02113-z,[HTML] biomedcentral.com,https://scholar.google.com/citations?user=u_pukecAAAAJ&hl=en&oi=sra,4 days ago,"of severe coronavirus infection 2019 (COVID-19), it  COVID-19 infections. 
In addition, the findings of the present study suggest that the mRNA vaccine against SARS-CoV-2",immune
Waning and boosting of antibody Fc-effector functions upon SARS-CoV-2 vaccination,https://www.nature.com/articles/s41467-023-39189-8,"X Tong, RP McNamara, MJ Avendaño… - Nature …, 2023 - nature.com",https://www.nature.com/articles/s41467-023-39189-8,[HTML] nature.com,https://scholar.google.com/citations?user=5Ebf33MAAAAJ&hl=en&oi=sra,4 days ago,"Since the emergence of SARS-CoV-2, vaccines targeting COVID-19 have  
coronavirus-2 (SARS-CoV-2) is the causative agent of coronavirus disease-2019 (COVID-19…",Vaccine
Comparing machine learning algorithms to predict COVID‑19 mortality using a dataset including chest computed tomography severity score data,https://www.nature.com/articles/s41598-023-38133-6,"SS Zakariaee, N Naderi, M Ebrahimi… - Scientific Reports, 2023 - nature.com",https://www.nature.com/articles/s41598-023-38133-6,[HTML] nature.com,https://scholar.google.com/citations?user=ArhpsbMAAAAJ&hl=en&oi=sra,4 days ago,") also known as severe acute respiratory syndrome coronavirus 2 (SARS-COV-2)  
severe acute respiratory syndrome coronavirus 2 (SARS-CoV-2) 2 . COVID-19 is a highly",tech
Phosphorylation of Oligopeptides: Design of Ultra-Hydrophilic Zwitterionic Peptides for Anti-Fouling Detection of Nucleic Acids in Saliva,https://pubs.acs.org/doi/abs/10.1021/acs.analchem.3c01843,"X Qiao, ZH Qian, W Sun, CY Zhu, Y Li… - Analytical …, 2023 - ACS Publications",,,,4 days ago,"severe acute respiratory syndrome coronavirus 2 (SARS-CoV-2) in undiluted 
saliva,  The precise diagnosis of SARS-CoV-2 is crucial to controlling COVID-19 coronavirus",detection
"Management of patients on antithrombotic therapy with severe infections: a joint clinical consensus statement of the ESC Working Group on Thrombosis, the ESC …",https://academic.oup.com/eurheartj/advance-article-abstract/doi/10.1093/eurheartj/ehad388/7223688,"B Gigante, JH Levy, E van Gorp… - European Heart …, 2023 - academic.oup.com",,,https://scholar.google.com/citations?user=qnH5V28AAAAJ&hl=en&oi=sra,4 days ago,"respiratory syndrome coronavirus 2 (SARS-CoV-2) infec… currently due to 
coronavirus disease 2019 (COVID-19).… and massive numbers of COVID-19 patients without pre-…",other_conditions
A Quality by Design Update on Nano-drug Delivery Systems,https://link.springer.com/chapter/10.1007/978-3-031-31505-3_6,"D Leonardi, MC Lamas, CJ Salomon - Introduction to Quality by Design in …, 2023 - Springer",,,https://scholar.google.com/citations?user=CmVnWqgAAAAJ&hl=en&oi=sra,4 days ago,"as a promising therapeutic approach for COVID-19 [68]. Propolis  for 
SARS-CoV-2, pathogenic coronavirus that cause a pandemic of acute respiratory disease (COVID-19)…",other_conditions
"Post COVID-19 syndrome 2 years following the first wave: the role of humoral response, vaccination and reinfection",https://academic.oup.com/ofid/advance-article-abstract/doi/10.1093/ofid/ofad364/7223659,"M Peghin, M De Martino, A Palese… - Open Forum …, 2023 - academic.oup.com",https://academic.oup.com/ofid/advance-article-abstract/doi/10.1093/ofid/ofad364/7223659,[HTML] oup.com,https://scholar.google.com/citations?user=zyI3PL4AAAAJ&hl=en&oi=sra,4 days ago,"Coronavirus disease 2019 (COVID-19) has led to an increasing population  
SARS-CoV-2 vaccination is not contraindicated in individuals with a history of acute COVID-19",Vaccine
"Relationship Between Fear of COVID-19, Conspiracy Beliefs About Vaccines and Intention to Vaccinate Against COVID-19: A Cross-National Indirect Effect Model in …",https://journals.sagepub.com/doi/abs/10.1177/01632787231186621,"T Caycho-Rodríguez, JM Tomás… - Evaluation & the …, 2023 - journals.sagepub.com",,,https://scholar.google.com/citations?user=tFYIfogAAAAJ&hl=en&oi=sra,4 days ago,"of fear of COVID-19 on the intention to be vaccinated against COVID-19 and the 
influence  To collect information, we used the Fear of COVID-19 Scale, Vaccine conspiracy",tech
"Exploring the interplay between climate, population immunity and SARS-CoV-2 transmission dynamics in Mediterranean countries",https://www.sciencedirect.com/science/article/pii/S0048969723041104,"JA Villatoro-García, R López-Domínguez… - Science of The Total …, 2023 - Elsevier",https://www.sciencedirect.com/science/article/pii/S0048969723041104/pdf?md5=5176c19287dd83160a1b3d236f4b6c20&pid=1-s2.0-S0048969723041104-main.pdf,[PDF] sciencedirect.com,https://scholar.google.com/citations?user=CWPqA28AAAAJ&hl=en&oi=sra,4 days ago,"indicate that transmission of SARS-CoV-2 may increase independently of  
COVID19 cases, the number of daily COVID-19 deaths, the daily percentage of fully COVID-19",public_health
Multiple thermocycles followed by LAMP with only two primers for ultrasensitive colorimetric viral RNA testing and tracking at single-base resolution,https://www.sciencedirect.com/science/article/pii/S0003267023008425,"P Zhang, K Qin, K Gao, F Su, H Wang, J Liu, Z Li - Analytica Chimica Acta, 2023 - Elsevier",,,,4 days ago,"As the SARS-CoV-2 ORF1ab gene was too long to  are commonly used for 
COVID-19 diagnosis. To assess  SARS-CoV-2 from three SARS-like coronaviruses by using",testing
Prediction of oxygen supplementation by a deep-learning model integrating clinical parameters and chest CT images in COVID-19,https://link.springer.com/article/10.1007/s11604-023-01466-3,"N Kawata, Y Iwao, Y Matsuura, M Suzuki… - Japanese Journal of …, 2023 - Springer",https://link.springer.com/article/10.1007/s11604-023-01466-3,[HTML] springer.com,,4 days ago,"coronavirus 2 (SARS-CoV-2) pneumonia and determination of disease 
severity [6].  of SARS-CoV-2 pneumonia [7,8,9], even in PCR-negative cases [10]. SARS-CoV-2",tech
The acceptance of COVID-19 pandemic control measures during congregational prayer on Muslims' emotional and social interaction,https://link.springer.com/article/10.1007/s11562-023-00534-9,"KA Mastor, MAA Samuri, F Md Sham, F Idris… - Contemporary Islam, 2023 - Springer",,,https://scholar.google.com/citations?user=0cchIUQAAAAJ&hl=en&oi=sra,4 days ago,"days ago - This study aims to examine the relationship between acceptance of the COVID-19 
pandemic control measures, emotions and social interaction among Muslims attending",wellbeing
New-onset and relapsed Graves' disease following COVID-19 vaccination: a comprehensive review of reported cases,https://eurjmedres.biomedcentral.com/articles/10.1186/s40001-023-01210-7,"K Chen, Y Gao, J Li - European Journal of Medical …, 2023 - eurjmedres.biomedcentral.com",https://eurjmedres.biomedcentral.com/articles/10.1186/s40001-023-01210-7,[HTML] biomedcentral.com,,4 days ago,"COVID-19, an acute respiratory infectious disease instigated by severe acute 
respiratory syndrome coronavirus 2 (SARS-CoV-2) [… of 700 million COVID-19 cases and over",Vaccine
Hyperimmune Globulins for the Management of Infectious Diseases,https://www.mdpi.com/1999-4915/15/7/1543,"I Pati, M Cruciani, F Candura, MS Massari, V Piccinini… - Viruses, 2023 - mdpi.com",https://www.mdpi.com/1999-4915/15/7/1543,[HTML] mdpi.com,https://scholar.google.com/citations?user=p6x6Bm8AAAAJ&hl=en&oi=sra,4 days ago,"therapeutics for coronavirus disease 2019 (COVID-19) [48,49].  COVID-19 
and in the early treatment of SARS-CoV-2 infected subjects at risk of a severe form of COVID-19 […",immune
Fc-Effector-Independent in vivo Activity of a Potent Influenza B Neuraminidase Broadly Neutralizing Antibody,https://www.mdpi.com/1999-4915/15/7/1540,"AM Khalil, MS Piepenbrink, I Markham, M Basu… - Viruses, 2023 - mdpi.com",https://www.mdpi.com/1999-4915/15/7/1540,[HTML] mdpi.com,https://scholar.google.com/citations?user=PeXiH1sAAAAJ&hl=en&oi=sra,4 days ago,"This reduction is perhaps influenced by the coronavirus disease 2019 (COVID-19) 
pandemic, the lack of an animal reservoir for IBV, and the recent severe reduction in IBV",other_conditions
Identification of a Putative SARS-CoV-2 Main Protease Inhibitor through In Silico Screening of Self-Designed Molecular Library,https://www.mdpi.com/1422-0067/24/14/11390,"N Liu, Z Yang, Y Liu, X Dang, Q Zhang, J Wang… - International Journal of …, 2023 - mdpi.com",https://www.mdpi.com/1422-0067/24/14/11390,[HTML] mdpi.com,,4 days ago,"Since the emergence of the coronavirus disease 2019 (COVID-19) in  coronavirus 
2 (SARS-CoV-2) has been identified as the primary pathogen responsible for COVID-19 […",tech
Statin Use in Relation to COVID-19 and Other Respiratory Infections: Muscle and Other Considerations,https://www.mdpi.com/2077-0383/12/14/4659,"BA Golomb, JH Han, PH Langsjoen… - Journal of Clinical …, 2023 - mdpi.com",https://www.mdpi.com/2077-0383/12/14/4659,[HTML] mdpi.com,,4 days ago,"“COVID or SARS-CoV-2” and “randomized”. An expanded search was 
attempted, allowing “randomized” to be an abstract term, but no additional randomized trials were",Lung_Cardio
The representative COVID-19 cohort Munich (KoCo19): from the beginning of the pandemic to the Delta virus variant,https://bmcinfectdis.biomedcentral.com/articles/10.1186/s12879-023-08435-1,"R Le Gleut, M Plank, P Pütz… - BMC Infectious …, 2023 - bmcinfectdis.biomedcentral.com",https://bmcinfectdis.biomedcentral.com/articles/10.1186/s12879-023-08435-1,[HTML] biomedcentral.com,https://scholar.google.com/citations?user=3Cg41TgAAAAJ&hl=en&oi=sra,4 days ago,"estimate prevalence of SARS-CoV-2 infections despite a  started the prospective 
Munich COVID-19 cohort (KoCo19… study we measured SARS-CoV-2 antibody prevalence",clinical_trial
"Influence of COVID-19 pandemic on the virus spectrum in children with respiratory infection in Xuzhou, China: a long-term active surveillance study from 2015 …",https://link.springer.com/article/10.1186/s12879-023-08247-3,"R Cao, Y Du, J Tong, D Xia, Q Song, Z Xia, M Liu… - BMC Infectious …, 2023 - Springer",https://link.springer.com/article/10.1186/s12879-023-08247-3,[HTML] springer.com,,4 days ago,"coronavirus 2 (SARS-CoV-2) are admitted to designated hospitals for 
quarantine and treatment. Therefore, the samples collected in this study were all SARS-CoV-2",public_health
Dyspnea in Post-Acute COVID-19: A Multi-Parametric Cardiopulmonary Evaluation,https://www.mdpi.com/2077-0383/12/14/4658,"A Cecchetto, G Guarnieri, G Torreggiani… - Journal of Clinical …, 2023 - mdpi.com",https://www.mdpi.com/2077-0383/12/14/4658,[HTML] mdpi.com,,4 days ago,"The clinical course of COVID-19 in its acute phase is now delineated in sufficient 
… The World Health Organization defines the post-acute sequelae of SARS-CoV-2 infection",long_covid
Clinical Features and Risk Stratification of Multiple Myeloma Patients with COVID-19,https://www.mdpi.com/2072-6694/15/14/3598,"R Zheng, K Mieth, C Bennett, C Miller, LD Anderson Jr… - Cancers, 2023 - mdpi.com",https://www.mdpi.com/2072-6694/15/14/3598,[HTML] mdpi.com,,4 days ago,"study and previous publications suggest that testing of neutralizing antibody 
post-SARS-CoV-2 vaccination in MM patients may be needed in reducing COVID-19 risk.",other_conditions
Impact of COVID vaccine and comorbidities in patients receiving casirivimab-imdevimab monoclonal antibody during SARS-CoV-2 B. 1.617. 2 (Delta) surge: A real …,https://www.sciencedirect.com/science/article/pii/S0264410X23008228,"P Agrawal, D Damania, A Cseh, J Grab, L Strom… - Vaccine, 2023 - Elsevier",,,https://scholar.google.com/citations?user=5aZiTJYAAAAJ&hl=en&oi=sra,4 days ago,"The Coronavirus Disease 2019 (COVID-19) pandemic  Respiratory Syndrome 
Coronavirus 2 (SARS-CoV-2). This  Clinical symptoms of SARS-CoV-2 vary from a mild cold",Vaccine
New Scenarios in Heart Transplantation and Persistency of SARS-CoV-2 (Case Report),https://www.mdpi.com/2075-1729/13/7/1551,"L Mitrofanova, I Makarov, A Gorshkov, O Vorobeva… - Life, 2023 - mdpi.com",https://www.mdpi.com/2075-1729/13/7/1551,[HTML] mdpi.com,,4 days ago,"of COVID-19 infection in the recipient, but this is unlikely, as no SARS-CoV-2 
antigen  We analyzed reported cases of coronavirus transmission during heart transplantation",Lung_Cardio
Differential Transcriptomic Landscapes of SARS-CoV-2 Variants in Multiple Organs from Infected Rhesus Macaques,https://www.sciencedirect.com/science/article/pii/S1672022923000955,"T Du, C Gao, S Lu, Q Liu, Y Yang, W Yu, W Li… - Genomics, Proteomics & …, 2023 - Elsevier",https://www.sciencedirect.com/science/article/pii/S1672022923000955,[HTML] sciencedirect.com,,4 days ago,"coronavirus 2 (SARS-CoV-2) caused the persistent  of SARS-CoV-2 and 
its VOC infection in the early stage, which will further deepen our understanding of COVID-19.",genetic_tools
Respiratory viruses in rural Zambia during the second year of the COVID-19 pandemic,https://www.sciencedirect.com/science/article/pii/S2772707623000735,"CG Sutcliffe, M Hamahuwa, E Miller, P Sinywimaanzi… - IJID Regions, 2023 - Elsevier",https://www.sciencedirect.com/science/article/pii/S2772707623000735,[HTML] sciencedirect.com,https://scholar.google.com/citations?user=JfGi-j0AAAAJ&hl=en&oi=sra,4 days ago,"To control the spread of severe acute respiratory syndrome coronavirus-2 (SARS-CoV-2),  
These measures not only impacted transmission of SARS-CoV-2 but also other",Lung_Cardio
