Title1,Title_URL,authors,paper_link,type,Scholarlink,time_since_pull,query_text_match,Keyword
Improving occupational safety in office spaces in the post-pandemic era,https://www.sciencedirect.com/science/article/pii/S221067072300392X,"N Sadeghi, N Gerami-Seresht - Sustainable Cities and Society, 2023 - Elsevier",https://www.sciencedirect.com/science/article/pii/S221067072300392X,[HTML] sciencedirect.com,https://scholar.google.com/citations?user=hT7hF5kAAAAJ&hl=en&oi=sra,5 days ago,"The COVID-19 pandemic has raised concerns regarding the resilience of 
human societies against widespread infectious diseases. Several COVID-19 outbreaks proved",long_covid
Clinical Trials Azvudine reduces the in-hospital mortality of COVID-19 patients: A retrospective cohort study,https://www.sciencedirect.com/science/article/pii/S2211383523002575,"K Zong, H Zhou, W Li, E Jiang, Y Liu, S Li - Acta Pharmaceutica Sinica B, 2023 - Elsevier",https://www.sciencedirect.com/science/article/pii/S2211383523002575,[HTML] sciencedirect.com,,5 days ago,"As an emerging infectious disease, the COVID-19 is caused by severe acute 
respiratory syndrome coronavirus 2 (SARS-CoV-2) 1 . As of Feb 19, 2023, there were more",other_conditions
Multi-hierarchical nanofibre membranes composited with ordered structure/nano-spiderwebs for air filtration,https://www.sciencedirect.com/science/article/pii/S2213343723013003,"X Cheng, Z Zhang, L Zhao, C Deng, C Li, Y Du… - Journal of …, 2023 - Elsevier",,,,5 days ago,"Furthermore, the outbreak and ongoing development of the coronavirus 
disease (COVID-19) caused by the SARS-CoV-2 virus, has increased the risk of inhalation",tech
Assessment of the frequency of SARS-CoV-2 Omicron variant escape from RNA-dependent RNA polymerase inhibitors and 3C-like protease inhibitors,https://www.sciencedirect.com/science/article/pii/S0166354223001493,"E Takashita, S Fujisaki, H Morita, S Nagata, H Miura… - Antiviral Research, 2023 - Elsevier",https://www.sciencedirect.com/science/article/pii/S0166354223001493,[HTML] sciencedirect.com,,5 days ago,"coronavirus 2 (SARS-CoV-2), which causes coronavirus disease 2019 (COVID-19),  
Targeting SARS-CoV-2 proteases and polymerase for COVID-19 treatment: state of",molecules
Interaction between COVID-19 and epilepsy during the omicron surge: A cross-sectional survey conducted in China tertiary hospital,https://www.sciencedirect.com/science/article/pii/S258998642300031X,"X Li, S Sun, C Yan, X Liu - Epilepsy & Behavior Reports, 2023 - Elsevier",https://www.sciencedirect.com/science/article/pii/S258998642300031X,[HTML] sciencedirect.com,,5 days ago,"acute respiratory syndrome coronavirus 2 (SARS-CoV-2) [… epilepsy and 
COVID-19, analyze SARS-CoV-2 infection  with epilepsy after SARS-CoV-2 infection and its",other_conditions
"Prevalence and determinants of depression, anxiety, and stress symptoms among Black individuals in Canada in the context of the COVID-19 pandemic",https://www.sciencedirect.com/science/article/pii/S0165178123002913,"JM Cénat, SMMM Farahi, R Darly - Psychiatry Research, 2023 - Elsevier",https://www.sciencedirect.com/science/article/pii/S0165178123002913,[HTML] sciencedirect.com,https://scholar.google.com/citations?user=TDo9_kwAAAAJ&hl=en&oi=sra,5 days ago,"coronavirus”); the ramifications of the pandemic on one's traumatic economic 
stress (4 items – eg “The Coronavirus (COVID-19… as a result of the coronavirus”). Past studies",symptoms
SARS-COV-2 specific t-cells in patients with thyroid disorders related to COVID-19 are enriched in the thyroid and acquire a tissue-resident memory …,https://www.sciencedirect.com/science/article/pii/S1521661623004473,"S Ylenia, C Francesca, M Giorgia, M Sara, C Elena… - Clinical …, 2023 - Elsevier",https://www.sciencedirect.com/science/article/pii/S1521661623004473,[HTML] sciencedirect.com,,5 days ago,"Since early 2020 the pandemic of Coronavirus disease 2019 (Covid-19), 
determined by the severe acute respiratory syndrome coronavirus 2 (SARS-CoV-2), has",molecules
Unlocking the Potential of PROTACs: A Comprehensive Review of Protein Degradation Strategies in Disease Therapy,https://www.sciencedirect.com/science/article/pii/S0045206823003814,"RP Bhole, PR Kute, RV Chikhale, CG Bonde, A Pant… - Bioorganic …, 2023 - Elsevier",,,https://scholar.google.com/citations?user=i9AxXbgAAAAJ&hl=en&oi=sra,5 days ago,"The development of therapeutic drugs has become more essential due to 
the high mortality and mutation rate of COVID-19, despite the fact that numerous vaccinations",medication_treatment
"Anti-inflammatory effect of 3-fluorophenyl pyrimidinylimidazo [2, 1-b] thiazole derivatives as p38α inhibitors",https://www.sciencedirect.com/science/article/pii/S0045206823003772,"MM Al-Sanea, MS Abdel-Maksoud, MF El-Behairy… - Bioorganic …, 2023 - Elsevier",,,https://scholar.google.com/citations?user=7Vu-IT4AAAAJ&hl=en&oi=sra,5 days ago,"In 2020, an outbreak and pandemic of corona virus (Covid 19) occurred; 
many reports referred the severity of the infection and high symptom frequency such as",inflammation
"Flu-like syndrome due to interferon-beta injections does not increase anxiety, depression, and lost working days in multiple sclerosis patients during the Sars-CoV-2 …",https://www.sciencedirect.com/science/article/pii/S0303846723003086,"V Mantero, P Basilico, R Balgera, A Rigamonti… - Clinical Neurology and …, 2023 - Elsevier",,,https://scholar.google.com/citations?user=82Y-xFcAAAAJ&hl=en&oi=sra,5 days ago,"coronavirus disease 2019 (COVID-19) infection and sometimes the two conditions 
may be confused or overlap. During the Sars-CoV-2  As a matter of fact, the Sars-CoV-2",medication_treatment
"Child and adolescent psychiatric emergency admissions before, during and after the Covid-19 Pandemic: An Interrupted time series analysis from Turkey",https://www.sciencedirect.com/science/article/pii/S187620182300254X,"S Kose, I Inal-Kaleli, E Boru, O Yavuz-Kan… - Asian Journal of …, 2023 - Elsevier",,,https://scholar.google.com/citations?user=9Sjucv0AAAAJ&hl=en&oi=sra,5 days ago,"The coronavirus disease (COVID-19) pandemic has  aspect of dealing with 
the COVID-19 pandemic, allocating the  It is crucial to acknowledge that the SARS-CoV-2 virus",tech
Mental health outcomes in frontline healthcare workers in Brazil during the COVID-19 epidemic: Results of an online survey in four regions using respondent …,https://www.sciencedirect.com/science/article/pii/S0010440X23000391,"M Cohen, RB Cardoso, LRFS Kerr, C Kendall… - Comprehensive …, 2023 - Elsevier",https://www.sciencedirect.com/science/article/pii/S0010440X23000391,[HTML] sciencedirect.com,https://scholar.google.com/citations?user=MqdYbuAAAAAJ&hl=en&oi=sra,5 days ago,"The pandemic caused by the SARS-CoV-2 virus emerged in 2019 as a 
highly  the coronavirus disease 2019 (COVID-19) outbreak in China: a case-control study",wellbeing
"How the COVID-19 pandemic affected bone health: a retrospective, longitudinal study on denosumab persistence from the epicentre of European spreading",https://link.springer.com/article/10.1007/s11657-023-01307-w,"M Varenna, F Orsini, R Di Taranto, F Zucchi… - Archives of …, 2023 - Springer",,,,5 days ago,"coronavirus-2 (SARS-CoV-2) mortality in Italy [13].  of COVID-19 infection 
reported in patients with prevalent vertebral fractures [27]. Consistently, fear of SARS-CoV-2 was",long_covid
Prevalence of and risk factors for self-reported menstrual changes following COVID-19 vaccination: a Danish cohort study,https://academic.oup.com/humrep/advance-article-abstract/doi/10.1093/humrep/dead144/7223488,"C Bisgaard Jensen, BH Bech, SN Hansen… - Human …, 2023 - academic.oup.com",,,https://scholar.google.com/citations?user=ZyUYhL4AAAAJ&hl=en&oi=sra,5 days ago,"Vaccines against the novel Coronavirus disease 2019 (COVID-19) were 
introduced  of mRNA BNT162b2 vaccine against SARS-CoV-2 infections and COVID-19 cases,",biomarkers
Characterization of the cellular lipid composition during SARS-CoV-2 infection,https://link.springer.com/article/10.1007/s00216-023-04825-1,"AM Abdel-Megied, IA Monreal, L Zhao, A Apffel… - Analytical and …, 2023 - Springer",,,https://scholar.google.com/citations?user=4zg8EccAAAAJ&hl=en&oi=sra,5 days ago,"SARS-CoV-2, the virus responsible for the COVID-19 pandemic, is a zoonotic 
… -spectrum antivirals against SARS-CoV-2 and at the minimum related coronaviruses.",misc
A Focused Review of the Initial Management of Patients with Acute Respiratory Distress Syndrome,https://www.mdpi.com/2077-0383/12/14/4650,"A Motes, T Singh, N Vinan Vega, K Nugent - Journal of Clinical Medicine, 2023 - mdpi.com",https://www.mdpi.com/2077-0383/12/14/4650,[HTML] mdpi.com,https://scholar.google.com/citations?user=B8z5_4YAAAAJ&hl=en&oi=sra,5 days ago,"Coronavirus disease 2019 affected several million people worldwide and 
challenged  for SARS-CoV-2 by PCR, who had ARF due to a cause other than COVID-19",Lung_Cardio
"Analyzing the relationship between air temperature and respiratory morbidity in children and the elderly in Porto Alegre, Brazil, before and during the COVID-19 …",https://link.springer.com/article/10.1007/s00484-023-02516-1,"EL Krüger, AS Nedel, AC dos Santos Gomes… - International Journal of …, 2023 - Springer",,,https://scholar.google.com/citations?user=JMkYdnMAAAAJ&hl=en&oi=sra,5 days ago,"days ago - The aim of the study was to analyze the relationship between air temperature 
data against hospital admissions due to respiratory diseases of children (under five years of",tech
Tracking B cell responses to the SARS-CoV-2 mRNA-1273 vaccine,https://www.cell.com/cell-reports/pdf/S2211-1247(23)00791-X.pdf,"FL de Assis, KB Hoehn, X Zhang, L Kardava, CD Smith… - Cell Reports, 2023 - cell.com",https://www.cell.com/cell-reports/pdf/S2211-1247(23)00791-X.pdf,[PDF] cell.com,https://scholar.google.com/citations?user=YKWaapEAAAAJ&hl=en&oi=sra,5 days ago,"coronavirus 2 (SARS-CoV-2) has led to an equally rapid worldwide effort to 
develop COVID-19  Despite the strong protective effects of mRNA and other SARS-CoV-2",Vaccine
Effectiveness of monovalent and bivalent COVID-19 vaccines,https://www.thelancet.com/journals/laninf/article/PIIS1473-3099(23)00379-1/fulltext,"T Cerqueira-Silva, VS Boaventura… - The Lancet Infectious …, 2023 - thelancet.com",,,https://scholar.google.com/citations?user=UbyXhckAAAAJ&hl=en&oi=sra,5 days ago,"type variant of SARS-CoV-2. This could  SARSCoV-2 no longer circulates 
among humans, this finding could suggest the need for a new antigen composition of COVID-19",Vaccine
Molecular Glue Discovery: Current and Future Approaches,https://pubs.acs.org/doi/abs/10.1021/acs.jmedchem.3c00449,"JA Dewey, C Delalande, SA Azizi, V Lu… - Journal of Medicinal …, 2023 - ACS Publications",,,https://scholar.google.com/citations?user=PZhEtvsAAAAJ&hl=en&oi=sra,5 days ago,"respiratory syndrome coronavirus (MERS-CoV), implying a similar methodology 
could discover compounds against SARS-CoV-2, the agent responsible for COVID-19. (…",molecules
Prokaryotic Argonautes for in vivo biotechnology and molecular diagnostics,https://www.cell.com/trends/biotechnology/fulltext/S0167-7799(23)00202-0,"BA Graver, N Chakravarty, KV Solomon - Trends in Biotechnology, 2023 - cell.com",,,https://scholar.google.com/citations?user=UORk8-EAAAAJ&hl=en&oi=sra,5 days ago,"Coronavirus disease 2019 (COVID- 19): an infectious disease caused by the 
SARS-CoV-2  severe acute respiratory syndrome coronavirus 2 (SARS-CoV-2) and its variant",detection
Robust and protective immune responses induced by heterologous prime‐boost vaccination with DNA‐protein dimeric RBD vaccines for COVID‐19,https://onlinelibrary.wiley.com/doi/abs/10.1002/jmv.28948,"Y An, G Zhao, H Duan, N Zhang, M Duan… - Journal of Medical …, 2023 - Wiley Online Library",,,,5 days ago,"The coronavirus disease 2019 (COVID-19) pandemic  Most reported COVID-19 
DNA vaccines and candidates  In the context of the continuous circulation of SARS-CoV-2,",immune
The effect of nirmatrelvir‐ritonavir on the long‐term risk of neuropsychiatric sequelae following COVID‐19,https://onlinelibrary.wiley.com/doi/abs/10.1002/jmv.28951,"TH Liu, JY Wu, PY Huang, YW Tsai… - Journal of Medical …, 2023 - Wiley Online Library",,,https://scholar.google.com/citations?user=-yFUu9MAAAAJ&hl=en&oi=sra,5 days ago,"coronavirus 2 (SARS-CoV-2) outbreak in December 2019, the global confirmed 
cases of COVID-19  the patients with SARS-CoV-2 infection can survive acute COVID-19, a",public_health
New‐onset and relapsed thrombotic microangiopathy post‐COVID‐19 vaccination,https://onlinelibrary.wiley.com/doi/abs/10.1002/jmv.28946,"Q Ma, G Xu - Journal of Medical Virology, 2023 - Wiley Online Library",,,,5 days ago,"Coronavirus disease 2019 (COVID-19), caused by severe acute respiratory 
syndrome coronavirus 2 (SARS-CoV-2), has posed an enormous obstruction to global public",Vaccine
Booster vaccinations and Omicron: the effects on SARS-CoV-2 antibodies in Dutch blood donors,https://bmcinfectdis.biomedcentral.com/articles/10.1186/s12879-023-08448-w,"FA Quee, BM Hogema, E Slot… - BMC Infectious …, 2023 - bmcinfectdis.biomedcentral.com",https://bmcinfectdis.biomedcentral.com/articles/10.1186/s12879-023-08448-w,[HTML] biomedcentral.com,,5 days ago,"coronavirus 2 (SARS-CoV-2) is an infectious pathogen and the causative pathogen 
of corona virus disease 2019 (COVID-19… and deaths due to COVID-19 [3]. After the start",Vaccine
… and feasibility of home and hospital follow-up in Burkina Faso and Guinea: A mixed-method study among patients of the COVID-19 Coverage-Africa clinical …,https://journals.plos.org/globalpublichealth/article?id=10.1371/journal.pgph.0001545,"M Plazy, MH Doucet, C Timbo Songbono… - PLOS Global Public …, 2023 - journals.plos.org",https://journals.plos.org/globalpublichealth/article?id=10.1371/journal.pgph.0001545,[HTML] plos.org,,5 days ago,"SARS-CoV-2 during the current COVID-19 pandemic [3, 4]. In some countries 
for instance, all people with COVID-19  , only people with severe COVID-19 symptoms were",other_conditions
Effects of Sirolimus Treatment on Fetal Hemoglobin Production and Response to SARS-CoV-2 Vaccination: A Case Report Study,https://www.mdpi.com/2038-8330/15/3/44,"MR Gamberini, C Zuccato, M Zurlo, LC Cosenza… - Hematology …, 2023 - mdpi.com",https://www.mdpi.com/2038-8330/15/3/44,[HTML] mdpi.com,https://scholar.google.com/citations?user=TtMSlJsAAAAJ&hl=en&oi=sra,5 days ago,"considering the coronavirus disease 2019 (COVID-19)  respiratory syndrome 
coronavirus 2 (SARS-CoV-2) antigens.  COVID-19 pandemic with extensive anti-SARS-CoV-2",Vaccine
Molnupiravir for the treatment of non-severe COVID-19: a systematic review and meta-analysis of 14 randomized trials with 34 570 patients,https://academic.oup.com/jac/advance-article-abstract/doi/10.1093/jac/dkad216/7223402,"M Sun, H Lai, J Huang, J Liu, Y Li, J Tian… - Journal of …, 2023 - academic.oup.com",,,,5 days ago,"Coronavirus disease 2019 (COVID-19) is an infectious disease caused by the 
SARS-CoV-2  The WHO declared COVID-19 a global pandemic, which may be one of the",tech
COVID-19 in Post-Acute and Long-Term Care: Challenges and Opportunities,https://link.springer.com/chapter/10.1007/978-3-031-28628-5_20,"N Pandya, E Hames, P Winn - Post-Acute and Long-Term Care Medicine …, 2023 - Springer",,,,5 days ago,", rhinovirus, enterovirus, non-COVID-19 coronavirus or RSV). Coinfection 
with  the SARS-CoV-2 virus and those who are not up to date with COVID-19 vaccination.",long_covid
Challenges for the food industry in controlling the transmission of SARS-CoV-2,https://link.springer.com/article/10.1007/s00003-023-01446-9,"CPZ Noreña, A Brandelli - Journal of Consumer Protection and Food …, 2023 - Springer",,,https://scholar.google.com/citations?user=K6xm8ioAAAAJ&hl=en&oi=sra,5 days ago,"of SARS-CoV-2 transmission in food systems and challenges imposed by the 
COVID-19  The novel coronavirus SARS-CoV-2 causes a severe acute respiratory syndrome,",public_health
The role of vaccines in the COVID-19 pandemic: what have we learned?,https://link.springer.com/article/10.1007/s00281-023-00996-2,"F Krammer - Seminars in Immunopathology, 2023 - Springer",https://link.springer.com/article/10.1007/s00281-023-00996-2,[HTML] springer.com,https://scholar.google.com/citations?user=7Fwb_7kAAAAJ&hl=en&oi=sra,5 days ago,"coronavirus 2 (SARS-CoV-2) emerged late in 2019 and caused the coronavirus 
disease 2019 (COVID-19)  impact on protection from SARS-CoV-2 mortality but with",Vaccine
"Post COVID-19 symptoms are common, also among young adults in the general population",https://www.nature.com/articles/s41598-023-38315-2,"I Mogensen, S Ekström, J Hallberg, A Georgelis… - Scientific Reports, 2023 - nature.com",https://www.nature.com/articles/s41598-023-38315-2,[HTML] nature.com,,5 days ago,"definition of post COVID-19 in December 2021: “Post COVID-19 condition is  
coronavirus 2 (SARS-CoV-2) infection; usually within three months from the onset of COVID-19…",symptoms
"Kinetics of specific anti-SARS-CoV-2 IgM, IgA, and IgG responses during the first 12 months after SARS-CoV-2 infection: A prospective longitudinal study",https://journals.plos.org/plosone/article?id=10.1371/journal.pone.0288557,"H Amellal, N Assaid, H Charoute, K Akarid, A Maaroufi… - Plos one, 2023 - journals.plos.org",https://journals.plos.org/plosone/article?id=10.1371/journal.pone.0288557,[HTML] plos.org,https://scholar.google.com/citations?user=i9DJ1nAAAAAJ&hl=en&oi=sra,5 days ago,"of severe acute respiratory syndrome coronavirus 2 (SARS-CoV-2) began 
with its  COVID-19 is the disease caused by SARS-CoV-2 and can manifest itself with a wide",long_covid
Vaccinations in children with hematologic malignancies and those receiving hematopoietic stem cell transplants or cellular therapies,https://onlinelibrary.wiley.com/doi/full/10.1111/tid.14100,"KA Neemann, AI Sato - Transplant Infectious Disease, 2023 - Wiley Online Library",https://onlinelibrary.wiley.com/doi/full/10.1111/tid.14100,[HTML] wiley.com,,5 days ago,"coronavirus 2 (SARS-CoV-2) also decreases the risk of  risk of SARS-CoV2 
breakthrough infection and COVID-19  should follow the COVID-19 vaccination according to",Vaccine
"Computational Aspects: Self-clean Coatings, Plastics and Polymers in Coatings",https://link.springer.com/chapter/10.1007/978-981-99-3549-9_8,"HS Gupta, U Shankar, A Verma, R Gogoi… - … Aspects, Applications and …, 2023 - Springer",,,https://scholar.google.com/citations?user=7KtxgPoAAAAJ&hl=en&oi=sra,5 days ago,"In the recent pandemic of COVID-19, the MD simulations have acted as a very 
… COVID-19 transmission. In the same line, Kushwaha et al. [54] have explored the COVID-19",genetic_tools
… in income-support payments reduce the demand for charity: A difference-in-difference analysis of charitable-assistance data from Australia over the COVID-19 …,https://journals.plos.org/plosone/article?id=10.1371/journal.pone.0287533,"C Ablaza, F Perales, C Parsell, N Middlebrook… - Plos one, 2023 - journals.plos.org",https://journals.plos.org/plosone/article?id=10.1371/journal.pone.0287533,[HTML] plos.org,https://scholar.google.com/citations?user=LkMM_fsAAAAJ&hl=en&oi=sra,5 days ago,"% of the population aged 15 and above—received the Coronavirus 
Supplement,  poverty from worsening due to the impacts of COVID-19, but in fact reduced pre-…",tech
"… and meta‐analysis on the serological, immunological, and cardiac parameters of the multisystem inflammatory syndrome (MIS‐C) associated with SARS‐CoV‐2 …",https://onlinelibrary.wiley.com/doi/abs/10.1002/jmv.28927,"G Ghazizadeh Esslami, S Mamishi… - Journal of Medical …, 2023 - Wiley Online Library",,,,5 days ago,"Coronavirus disease 2019 (COVID-19), induced by the novel severe acute 
respiratory syndrome coronavirus 2 (SARS-CoV-2),  During the global spread of the COVID-19",tech
Effect of DMARDs on the immunogenicity of vaccines,https://www.nature.com/articles/s41584-023-00992-8,"Y van Sleen, KSM van der Geest… - Nature Reviews …, 2023 - nature.com",,,,5 days ago,"This Review focuses on the impact of DMARDs on influenza and SARS-CoV-2  
infected cells, only some vaccine platforms are potent activators of these cells 18,19 .",Vaccine
Adjuvant Oligonucleotide Vaccine Increases Survival and Improves Lung Tissue Condition of B6. Cg-Tg (K18-ACE2) 2 Transgenic Mice,https://www.mdpi.com/2218-0532/91/3/35,"VV Oberemok, KV Laikova, KA Yurchenko… - Scientia …, 2023 - mdpi.com",https://www.mdpi.com/2218-0532/91/3/35/pdf,[PDF] mdpi.com,https://scholar.google.com/citations?user=1usyDvsAAAAJ&hl=en&oi=sra,5 days ago,"our next encounter with a SARS-CoV-2 coronavirus pandemic. Unfortunately, 
there  in prophylaxes of COVID-19 and other diseases caused by coronaviruses and RNA",medication_treatment
A Real-World Multicenter Retrospective Observational Study on Polish Experience with Nintedanib Therapy in Patients with Idiopathic Pulmonary Fibrosis …,https://www.mdpi.com/2077-0383/12/14/4635,"S Majewski, AJ Białas, A Barczyk… - Journal of Clinical …, 2023 - mdpi.com",https://www.mdpi.com/2077-0383/12/14/4635,[HTML] mdpi.com,https://scholar.google.com/citations?user=cmZsyKQAAAAJ&hl=en&oi=sra,5 days ago,"were related to coronavirus disease 2019 (COVID-19). This  coronavirus 2 
(SARS-CoV-2), which causes COVID-19, and  and severity of SARS-CoV-2 infections among all",medication_treatment
Long COVID prevalence and associated characteristics among a South Alabama population,https://www.sciencedirect.com/science/article/pii/S003335062300197X,"CL Daniel, S Fillingim, J James, J Bassler, A Lee - Public Health, 2023 - Elsevier",,,https://scholar.google.com/citations?user=qEcMzisAAAAJ&hl=en&oi=sra,5 days ago,"more than 1.5 million COVID-19 cases and more than  symptoms due to the 
current coronavirus is not novel, as  of SARS-CoV-2 (PASC) after diagnosis of symptomatic",long_covid
Global landscape of encephalitis: key priorities to reduce future disease burden,https://academic.oup.com/cid/advance-article-abstract/doi/10.1093/cid/ciad417/7223266,"J Granerod, Y Huang, NWS Davies… - Clinical Infectious …, 2023 - academic.oup.com",https://academic.oup.com/cid/advance-article-pdf/doi/10.1093/cid/ciad417/50861175/ciad417.pdf,[PDF] oup.com,https://scholar.google.com/citations?user=8NTevfUAAAAJ&hl=en&oi=sra,5 days ago,"The effects of Zika virus, severe acute respiratory syndrome coronavirus 2, 
and  BDM is supported to conduct COVID-19 neuroscience research by the UKRI/MRC (MR/…",Vaccine
Impact of coronavirus disease 2019 (COVID-19) on antimicrobial resistance among major pathogens causing healthcare-associated infection,https://www.sciencedirect.com/science/article/pii/S0929664623002541,"HC Chang, CH Chang, KL Tien, CH Tai, LM Lin… - Journal of the Formosan …, 2023 - Elsevier",https://www.sciencedirect.com/science/article/pii/S0929664623002541,[HTML] sciencedirect.com,,5 days ago,"hand, precautions for preventing SARS-CoV-2 spreading have been applied 
by  and during COVID-19 pandemic, in order to know the effect of COVID-19 on epidemiology",anti
Systems-level profiling of early peripheral host-response landscape variations across COVID-19 severity states in an Indian cohort,https://www.nature.com/articles/s41435-023-00210-1,"U Banerjee, S Chunchanur, KN Balaji, A Singh… - Genes & …, 2023 - nature.com",,,https://scholar.google.com/citations?user=xc1Q16sAAAAJ&hl=en&oi=sra,5 days ago,"COVID-19 in China, different aspects of the disease have been widely studied. 
Host immune response to SARS-CoV-2  families of viruses including coronaviruses. Our",clinical_trial
PLSCR1 is a cell-autonomous defence factor against SARS-CoV-2 infection,https://www.nature.com/articles/s41586-023-06322-y,"D Xu, W Jiang, L Wu, RG Gaudet, ES Park, M Su… - Nature, 2023 - nature.com",https://www.nature.com/articles/s41586-023-06322-y,[HTML] nature.com,https://scholar.google.com/citations?user=-QTeljoAAAAJ&hl=en&oi=sra,5 days ago,"-SARS-CoV-2 defence. Characterizing its activity will provide insights into how 
cell-autonomous immunity confers frontline resistance during COVID-19  blocks coronavirus",tech
Prolonged-release pirfenidone in patients with pulmonary fibrosis as a phenotype of post-acute sequelae of COVID-19 pneumonia. Safety and efficacy,https://www.sciencedirect.com/science/article/pii/S0954611123002500,"RH Sansores, A Ramírez-Venegas, F Montiel-Lopez… - Respiratory …, 2023 - Elsevier",,,https://scholar.google.com/citations?user=IFNOmz0AAAAJ&hl=en&oi=sra,5 days ago,"Coronavirus disease 2019 (COVID-19), caused by severe acute respiratory 
syndrome coronavirus-2 (SARS-CoV-2… acute sequelae of COVID-19 (PASC) or Long COVID [4,…",long_covid
Increased Emergency Department Stays for Mental Health of Insured Youth in Year 2 of the COVID-19 Pandemic—Moving Forward,https://jamanetwork.com/journals/jamapsychiatry/article-abstract/2806890,"KB Wells - JAMA psychiatry, 2023 - jamanetwork.com",,,,5 days ago,"to avoid exposure to the SARSCoV-2 virus and staffing issues)  Articles on 
the effect of the COVID-19 pandemic on  program for the COVID-19 pandemic with input from",wellbeing
Metagenomic assessment of gut microbial communities and risk of severe COVID-19,https://genomemedicine.biomedcentral.com/articles/10.1186/s13073-023-01202-6,"LH Nguyen, D Okin, DA Drew… - Genome …, 2023 - genomemedicine.biomedcentral …",https://genomemedicine.biomedcentral.com/articles/10.1186/s13073-023-01202-6,[HTML] biomedcentral.com,https://scholar.google.com/citations?user=rFnNWVAAAAAJ&hl=en&oi=sra,5 days ago,"have been infected with SARS-CoV-2 and developed coronavirus disease-2019 
(COVID-19),  in gut microbial communities and COVID-19, demonstrating the generalized",public_health
